0.2028985507246377,1.11ab,jñānavidā mahādevaḥ hṛdayāntari saṁsthitaḥ ||,11.45ab,idaṁ jñānam mahādevi siddhāntan nāma nāmataḥ ||
0.20270270270270271,7.23cd,bhakāro bhagavān brahmā ekatattva-trayībhavet |,7.27ab,jagatsṛṣṭis tathā brahmā viṣṇuḥ pālayito bhavet ||
0.20270270270270271,5.37ab,nirbāṇam paramaṁ dhyātvā saṁśuddhaṁ padam āpnuyāt ||,7.11cd,sarvāṅguli-śivaṁ jñeyam muktāntaṁ padam āpnuyāt |
0.20270270270270271,5.33cd,na sadbuddhiḥ karaṇāntam naivāsadbuddhy-anāśravam |,5.35cd,asatbuddhiḥ suṣuptākhyam naiva sat tūryasaṅjñikam |
0.20270270270270271,5.1cd,yadi prāṇaṁ parityaktam śūnyadhyānaṁ samārabhet |,5.29ef,sarvaṁ tyaktaṁ paraṁ śūnyam nirbāṇam paramaṁ brajet ||
0.20270270270270271,4.3cd,taijasaḥ buddhim āyatvam gauṇikaṁ sūkṣmadehakam |,4.4cd,buddhir abyaktam āyatvam tamodhikam atīndriyam |
0.20270270270270271,3.32ab,sparśatanmātrato bāyuḥ sa tvaksukham ajījanat ||,3.40ab,rūpatanmātrato pāyuḥ maitrī devam adhikramam ||
0.20270270270270271,1.33ab,aiśvaryavṛddhim ādhikyam sarvabhūtavaśaṅkaram ||,5.22ab,sarvaiśvaryaśūnyam idam śuddhaṁ paramanirmalam ||
